texto|categoria
Comencé a laborar y al mes me hicieron retención salarial llegue a un acuerdo para cancelar y ahora la empresa a un continua con la retencion salarial y ustedes cobrandome la cuota, estoy pagando mensualmente 700 mil pesos hace 4 meses y mi salario es de 1.050.000 ¿dígame usted si eso es justo?|negative
Buenas cuando realizarán el giro de sostenimiento, debo cancelar el seguro de icetex. Ya me están mandando el recibo al correo.|negative
Buenos días cuántos días se demoran en desembolsar el crédito de sostenimiento.|positive
Que beneficios obtengo porque soy indígena es decir puedo tener el bono de sostenimiento|positive
Que beneficios obtengo porque soy indígena|positive
Buena noche señores ICETEX quiero que mi hija estudie en la universidad Ella es víctima y en el 2020 se graduó de bachillerato y no tenemos con que pagarle una universidad quiero que me ayude.. gracias|positive
Comencé a laborar y al mes me hicieron retención salarial llegue a un acuerdo para cancelar y ahora la empresa a un continua con la retencion salarial y ustedes cobrandome la cuota, estoy pagando mensualmente 700 mil pesos hace 4 meses y mi salario es de 1.050.000 ¿dígame usted si eso es justo?|negative
No pude ni hacer el pregrado porqué no hubo disque más cupo .Y me toco retirarme.Que decepción...|negative
Hasta cuándo hay plazo para postularse ? |neutral
Tengo una consulta sobre resultados de la convocatoria de Docentes Etnoeducadores.|neutral
Normal RCN y Caracol todos son comprados|neutral
Por favor estamos esperando el acta de los resultados de las becas artistas jóvenes talento. Hay muchas inconsistencias en esa convocatoria. Además que los resultados aún no se ven por ninguna parte. Se llama a un asesor y no saben, dan el enlace de solicitud de becas y tampoco sale nada, se revisa en la solicitud del perfil del solicitante y tampoco. Cómo es que una convocatoria de cientos de miles de dólares no tiene un acta pública con resultados de los ganadores, no ganadores y personas que no cumplieron con los requisitos, así lo hicieron en el 2018 y así lo deberían hacer ahora. Me parece una total falta de transparencia esa convocatoria y para sumar SIN DAR PREVIO AVISO cambiaron la fecha de resultados un mes. Y Hasta ahora no se ven los resultados por ningún lado. Ya otros usuarios les piden razón y tampoco dan un link que funcione para resolver la inquietud.|neutral
Y entonces porque yo no pude estudiar porque el ICETEX cerro los cupos en el departamento de Córdoba|neutral
Entonces porque no apoyan a todas las líneas de credito que tengan sisben como lo hacían anteriormente   para   subsidios  y condonaciones ahora  solo  apoyan a lineas de credito  hasta el 25% .|negative
Donde están los resultados  de los jóvenes? Le doy en ele enlace y no sale nada. Los asesores dicen que se debe esperar para saber si es o no beneficiario por que aun no están los resultados????|negative
Cuando salen los resultados de la convocatoria de docentes etnoeducadores?|neutral
pura propaganda .porque la realidad es una dura crueldad porque las ayudas no se ven|negative
no entiendo pq si uno llama 8 veces el mismo día, 8 veces verifican datos|neutral
No hay institución más comprometida y garante que el Icetex!|neutral
Dios lo bendiga y logre todos los objetivos que se proponga. Bendiciones sobrino|positive
El Fondo para Comunidades negras cuánto cubre semestralmente ?|neutral
Buen día una pregunta una persona que tiene un reporte en centrales de riesgo se puede postular al fondo de comunidades negras?|negative
He llamado varias veces para recibir instrucciones sobre el formulario CIFIN y todos me dan razones diferentes. Deberían cargar un instructivo con el paso a paso sobre cómo llenar los formularios.|neutral
Hola yo tengo una pregunta, en el periodo 2021-1  no tuve derecho al subsidio por el sisbe  pero ya mi sisben en la versión IV cumplo con el corte ya realice la renovación si tengo  derecho a este giro.?|neutral
Buenas tardes para preguntar cuando hacel el giro de sostenimiento componente equidad del periodo 2021 - 1|positive
Cuándo inician los giros de créditos de sostenimiento?|neutral
Cuando inician los giros??|neutral
Buenas nohes señores Icetex ¿cuando inician los giros de sostenimiento ?|neutral
Cuando publican resultados de la convocatoria del fondo de víctimas|negative
Cuándo publican los resultados del comité de crédito de convocatoria 2021-2? Para la línea a largo plazo.|neutral
Cuando publican los resultados de los jóvenes talentos, debería hacerse público. |neutral
Jaaa mi hijo  lo tramito desde diciembre lo culminó en febrero el proceso y esta es la fecha no ah girado..solo dilatando el proceso...|negative
Lo resultados de las líneas tradicionales los publican hoy?|neutral
Buenos días! Cuando publican resultados de la convocatoria 2021-2  para Víctimas del conflicto armado?|neutral
Para cuando los resultados de víctimas del conflicto armado ?? dijeron 21 y ya hoy es 23|negative
doctor ACVEDO con todo respeto donde quedo la condonación de la deuda de los maestros de as becas de la excelencia se mandan todos los documentos y ahora llegan los cobros y el comité no avala la condonación es injusto y grave para su credibilidad . Loa maestros que accedieron a las becas desde 2015 son puntales en los colegios , son hombres y mujeres que con sus proyectos construyen y dinamizan las escuelas , y se habla de una beca y ahora LLEGAN LOS COBROS . Le solicitamos respetuosamente atender nuestro llamado Y solucionar la problemática de muchos maestros. CRÉDITO 2822714 EN MI CASO. CAS-9161778-C9W7Z4 Y CAS-11916008-W7Y9Z9 . LE PEDIMOS SOLIDARIDAD EN ESTOS CASOS .|negative
Buenas soy docente beneficiario de las becas de excelencia para maestría, cumplí con todoa los requisitos, entrgue la documentación requerida, y repetidas ocasiones he reclamado por se me niega la condonación y la repuesta es la misma, exijo respeto y complimiento de la condición, ya que esta beca fue reconocimiento por nuestra labor en el magisterio colombiano y ahora nos quoereb cobrar a partir de julio del presente año.|positive
Buenas, soy docente y se me otorgó una beca, bajo la modalidad de becas  para la excelencia, cumplí con todos los requisitos para la condonación de mi deuda por parte de Icetex, y este proceso ha Sido muy irregular, he presentado distintas peticiones, llamadas, me indican, inicialmente que se me ha condonado la deuda y días después me llegan cobros de esta misma, tengo toda la evidencia y esto no ha servido de nada.Muchas gracias por la atención y esperamos solución a dicha problemática|neutral
Conozco casos aprobados desde el 2020 y nada q hacen los desembolsos a los colegios. |neutral
Hagan una feria en cartagena a ver si me pueden escuchar, ya que no cumplen con los acuerdos de pago ??|negative
Regalen me el número|neutral
Hola buenos días soy estudiante finalizando auxiliar administrativo pero quiero seguir estudiando administración de empresas  mi categoría en el Sisbén es B6 quisiera que me prestaran plata para seguir en mis estudios mi correo es eiderarenas2012@gmail.com y mi número de celular es 3224406478 soy de Sanmartín meta... Les pido se comuniquen conmigo|positive
no caigan en esa tramnpa|neutral
Eso no sirve, uno va y ninguna solucion le dan, simplemente le dicen que pague y ya.|negative
Buenos dias... Estoy embolatada con la legalizacion de mi credito, he escrito por todos lados para que algun asesor me ayude pero nadie responde... Me ayudan por favor|positive
El icetex que me ayude por favor con mi situación Gracias|neutral
Eso es cierto, NO COBRAN por lo tanto no engañan.Pero engañan. Porqué son solo publicidad.Solo mentirasMi hija lleva dos años aplicando y cumpliendo con todos lis requisitos que exigen y nunca sale favorecida.Dejen tanta mentira.|negative
Buenos dias. Como se hace para anular una solicitud de credito. Cuales son los pasos ya que al momento se la registro con cedula y es tarjeta de identidad. Apenas es el primer paso. Por favor enviar los pasos como anular.|positive
Será desinformación, porque no han publicado la convocatoria para desplazados que esta vigente?|negative
Gracias los Amo|positive
Yo amo el Icetex!|positive
Juega con las personas miren en tiempo que están dando, usted habre el  enlace y la convocatoria está cerrada qué manera de burlace de las víctimas ????|negative
Buenas noches , para el crédito condonables aplica deudor solidario|positive
Hay presunta corrupción. Usando se giran dineros a universidad politécnico Gran Colombiano aunque se haya solicitado la anulación del crédito, y aún así el director y jefe de cartera hGiran dineros para que otros ganen intereses con lso dineros del icetex y haya corrupción administrativa|negative
Icetex es una mierda.|negative
Esta informacion la dan cuando faltan solo pocos dias y la quitan.Tras de que no se puede acceder|negative
Lo mismo de siempre. Publicidad|neutral
No entiendo porque abren la convocatoria solo para los que viven en Bogotá, que injusto me parece.|negative
Es para personas de cualquier parte del país o solo de Bogotá?|neutral
Para inscribirse hay que estar inscrito en la u. Quien me ayuda?|positive
Aplica para todas las ciudades?|neutral
La verdad no entiendo de que sirven los convenios con las universidades si al hablar con la universidad dice que es independiente al Icetex y al contrario,no brindan soluciones solo se tiran la pelota de un lado al otro,Aparte esa demora para una simple respuesta,Un estudio de más de dos meses,Cuando ya dan respuesta se acabó el semestre o se perdió la admisión.|negative
Porque no  tienen diálogo directo con las universidades en la que la persona va a empezar su formación profesional? Que vaina esa de jugar con los sueños de la gente, se pierde la oportunidad de un cupo en una universidad, porque el icetex no desembolsa rápido, no brinda más opciones, no dialoga con la universidad pertinente, no se entra a mediar al benificio del implicado, se necesitan respuestas.|negative
Tanto que ofrecen inpulsatones y miles de cosas para uno acceder a un crédito y en en este momento por demoras en el proceso estoy perdiendo la oportunidad de iniciar a estudiar, no es justo que si se solicita un crédito por la demora de los pasos de los mismo, las universidades con  convenio  exijan pagos, si se supone que si uno realiza un proceso de crédito es porque no tiene como pagar, siento que mi derecho a la educación está siendo vulnerado por demoras en los proceso de icetex y aún peor los convenios para los que ingresan a primer semestre no sirven de nada, en este momento me siento desilusiónado de icetex y mi sueño frustrado.|negative
Tanto que ofrecen inpulsatones y miles de cosas para uno acceder a un crédito y en en este momento por demoras en el proceso estoy perdiendo la oportunidad de iniciar a estudiar, no es justo que si se solicita un crédito por la demora de los pasos de los mismo, las universidades con  convenio  exijan pagos, si se supone que si uno realiza un proceso de crédito es porque no tiene como pagar, siento que mi derecho a la educación está siendo vulnerado por demoras en los proceso de icetex y aún peor los convenios para los que ingresan a primer semestre no sirven de nada, en este momento me siento desilusiónado de icetex y mi sueño frustrado.|negative
Tanto que ofrecen inpulsatones y miles de cosas para uno acceder a un crédito y en en este momento por demoras en el proceso estoy perdiendo la oportunidad de iniciar a estudiar, no es justo que si se solicita un crédito por la demora de los pasos de los mismo, las universidades con  convenio  exijan pagos, si se supone que si uno realiza un proceso de crédito es porque no tiene como pagar, siento que mi derecho a la educación está siendo vulnerado por demoras en los proceso de icetex y aún peor los convenios para los que ingresan a primer semestre no sirven de nada, en este momento me siento desilusiónado de icetex y mi sueño frustrado.|negative
Desde cuándo están  haciendo eso yo me acerque  a pedir un crédito   ya hice toda la gestión y gracias a ello perdí mi quesito cuáles convenios  de nada  hice todo lo que pude y no me colaboraron. Que falta de respeto en la educación de Colombia  ahora todo es palanca y comprar con plata a la gente para  que le den oportunidades y comprar hasta el favor ????|negative
Cuáles son los  los subsidios porque la verdad no los veo ya que es falso tanto proceso para para que al final sean trabas para todo ??que ofensa|negative
Tanto que ofrecen inpulsatones y miles de cosas para uno acceder a un crédito y en en este momento por demoras en el proceso estoy perdiendo la oportunidad de iniciar a estudiar, no es justo que si se solicita un crédito por la demora de los pasos de los mismo, las universidades con  convenio  exijan pagos, si se supone que si uno realiza un proceso de crédito es porque no tiene como pagar, siento que mi derecho a la educación está siendo vulnerado por demoras en los proceso de icetex y aún peor los convenios para los que ingresan a primer semestre no sirven de nada, en este momento me siento desilusiónado de icetex y mi sueño frustrado.|negative
Estoy apunto de perder mi oportunidad de comenzar mis estudios por culpa de la demora en los procesos,Aparte los dichosos convenios que dicen tener no sirven de nada,Ya que a pesar de aplicar a una universidad convenio esa universidad me pide el pago del primer semestre para asegurar un cupo,Es claro y casi obvio que si se pide un crédito es porque no se cuenta con el dinero en el momento.Es muy desalentador saber que no se apoya la educación por ningún medio.|negative
Cuáles son los  los subsidios porque la verdad no los veo ya que es falso tanto proceso para para que al final sean trabas para todo ??que ofensa|negative
Buenas tardes.Porque en el punto dónde hay que llenar la información del codeudor sale error. A qué se debe o es una falla de la página|negative
Yo solicite el crédito el mes pasado y aún no me han mandado el correo con firmas de garantías.Entonces pq dicen mentiras?|negative
Totalmente de acuerdo no se  me dió la oportunidad de estudiar  ???? ya que no me brindaron la oportunidad   de emprender mis sueños  y por eso me quede sin  estudiar ??|negative
Cuales beneficios? Un proceso largo para ver si se logra ser admitido al crédito que se desea, y cuando ya se es admitido, el desembolso al pago del semestre se demora más de dos meses.|negative
De que beneficio? Acaso rogar pa que le presten para estudiar y que luego toca pagar  duplicado es un beneficio? no pues graciasss|neutral
Tanto que ofrecen inpulsatones y miles de cosas para uno acceder a un crédito y en en este momento por demoras en el proceso estoy perdiendo la oportunidad de iniciar a estudiar, no es justo que si se solicita un crédito por la demora de los pasos de los mismo, las universidades con  convenio  exijan pagos, si se supone que si uno realiza un proceso de crédito es porque no tiene como pagar, siento que mi derecho a la educación está siendo vulnerado por demoras en los proceso de icetex y aún peor los convenios para los que ingresan a primer semestre no sirven de nada, en este momento me siento desilusiónado de icetex y mi sueño frustrado.|negative
Totalmente de acuerdo no se  me dió la oportunidad de estudiar  ???? ya que no me brindaron la oportunidad   de emprender mis sueños  y por eso me quede sin  estudiar ??|negative
Tanto que ofrecen inpulsatones y miles de cosas para uno acceder a un crédito y en en este momento por demoras en el proceso estoy perdiendo la oportunidad de iniciar a estudiar, no es justo que si se solicita un crédito por la demora de los pasos de los mismo, las universidades con  convenio  exijan pagos, si se supone que si uno realiza un proceso de crédito es porque no tiene como pagar, siento que mi derecho a la educación está siendo vulnerado por demoras en los proceso de icetex y aún peor los convenios para los que ingresan a primer semestre no sirven de nada, en este momento me siento desilusiónado de icetex y mi sueño frustrado.|negative
Por eso appyamos el paro|neutral
sabias que estos beneficios se tardan en ser desembolsados, y se pierde la oportunidad de estudiar por lo mismo.|negative
Totalmente de acuerdo no se  me dió la oportunidad de estudiar  ???? ya que no me brindaron la oportunidad   de emprender mis sueños  y por eso me quede sin  estudiar ??|negative
Tanto que ofrecen inpulsatones y miles de cosas para uno acceder a un crédito y en en este momento por demoras en el proceso estoy perdiendo la oportunidad de iniciar a estudiar, no es justo que si se solicita un crédito por la demora de los pasos de los mismo, las universidades con  convenio  exijan pagos, si se supone que si uno realiza un proceso de crédito es porque no tiene como pagar, siento que mi derecho a la educación está siendo vulnerado por demoras en los proceso de icetex y aún peor los convenios para los que ingresan a primer semestre no sirven de nada, en este momento me siento desilusiónado de icetex y mi sueño frustrado.|negative
Totalmente de acuerdo no se  me dió la oportunidad de estudiar  ???? ya que no me brindaron la oportunidad   de emprender mis sueños  y por eso me quede sin  estudiar ??|negative
La verdad no entiendo de que sirven los convenios con las universidades si al hablar con la universidad dice que es independiente al Icetex y al contrario,no brindan soluciones solo se tiran la pelota de un lado al otro,Aparte esa demora para una simple respuesta,Un estudio de más de dos meses,Cuando ya dan respuesta se acabó el semestre o se perdió la admisión.|negative
Tanto que ofrecen inpulsatones y miles de cosas para uno acceder a un crédito y en en este momento por demoras en el proceso estoy perdiendo la oportunidad de iniciar a estudiar, no es justo que si se solicita un crédito por la demora de los pasos de los mismo, las universidades con  convenio  exijan pagos, si se supone que si uno realiza un proceso de crédito es porque no tiene como pagar, siento que mi derecho a la educación está siendo vulnerado por demoras en los proceso de icetex y aún peor los convenios para los que ingresan a primer semestre no sirven de nada, en este momento me siento desilusiónado de icetex y mi sueño frustrado.|negative
Cuáles son los  los subsidios porque la verdad no los veo ya que es falso tanto proceso para para que al final sean trabas para todo ??que ofensa|negative
La verdad no entiendo de que sirven los convenios con las universidades si al hablar con la universidad dice que es independiente al Icetex y al contrario,no brindan soluciones solo se tiran la pelota de un lado al otro,Aparte esa demora para una simple respuesta,Un estudio de más de dos meses,Cuando ya dan respuesta se acabó el semestre o se perdió la admisión.|negative
Tanto que ofrecen inpulsatones y miles de cosas para uno acceder a un crédito y en en este momento por demoras en el proceso estoy perdiendo la oportunidad de iniciar a estudiar, no es justo que si se solicita un crédito por la demora de los pasos de los mismo, las universidades con  convenio  exijan pagos, si se supone que si uno realiza un proceso de crédito es porque no tiene como pagar, siento que mi derecho a la educación está siendo vulnerado por demoras en los proceso de icetex y aún peor los convenios para los que ingresan a primer semestre no sirven de nada, en este momento me siento desilusiónado de icetex y mi sueño frustrado.|negative
Cuáles son los  los subsidios porque la verdad no los veo ya que es falso tanto proceso para para que al final sean trabas para todo ??que ofensa|negative
Cuáles son los  los subsidios porque la verdad no los veo ya que es falso tanto proceso para para que al final sean trabas para todo ??que ofensa????????no sirve para nada. No sé enfoca. En la educación de Colombia. Yo no sé para qué publican publicidad barata ?|negative
Totalmente de acuerdo no se  me dió la oportunidad de estudiar  ???? ya que no me brindaron la oportunidad   de emprender mis sueños  y por eso me quede sin  estudiar ??|negative
Puedo hacer parte del fondo|neutral
Como hago para acceder gracias|neutral
Buen día, estamos esperando los resultados de la beca Jóvenes Talentos 2021. |neutral
Hola buenas tardes para preguntar sobre la convocatoria de victimas del conflicto armado|negative
saludos, dónde puedo ver los resultados de jóvenes talentos 2021|neutral
Hola buenas tardes |positive
Para educación también tienen becas?|neutral
saludos, dónde puedo ver los resultados de jóvenes talentos 2021|neutral
si claro 60 becas que se quedan en la rosca|negative
Link para revisar requisitos y detalles de la convocatoria|neutral
Puedo hacer parte de este fondo|neutral
saludos, dónde puedo ver los resultados de jóvenes talentos 2021|neutral
Necesito un asesor|neutral
Hola,Cuando pagan el subsidio de sostenimiento 2021 2?|neutral
Realice mi proceso de inscripción de cuenta el día 15 de julio , soy generación E y nueva usuaria , me llega el giró ??|neutral
Como se puede obtener o tramitar esa beca por promedio?|neutral
No han publicado los beneficiarios, según el calendario era el 27 de Julio|neutral
Cómo hago yo para lograr eso también|neutral
Buenas tardes. Dónde hacen esas ferias? Puedo aplicar también para condonación?|positive
Ojala salgan ofertas para extranjeros pronto! Saludos!|positive
Buenas tardes quisiera saber hasta cuándo tengo la fecha para presentar documentos para la condonación del crédito para jardines y colegios|positive
Y de que lado cogió al icetex que condonaron totalmente el crédito?|neutral
Hola buenas tardes, me gustaría poder ser una beneficiara del ese tipo de condonaciones… Me podrían dar más información para aplicar?|positive
ICETEX, quisiera preguntar cuando vuelven a abrir convocatorias de las líneas Tú Eliges 0% y 25%, entiendo que ya cerró convocatoria para los 9000 cupos, pero si una persona está interesada en éstas líneas sin los beneficios de esa convocatoria no puede? punto negativo para ICETEX. |neutral
ICETEX  abrirán de nuevo la convocatoria de crédito para protección constituciónal?|neutral
Como se soluciona esto? Donde se puede tener una respuesta ediciente y efectiba en messenger dice que hay mora ese es el problema Superintendencia Financiera de Colombia|negative
Realicé el pago y sigue saliendo saldo en mora|neutral
HL buenas yo dezplazada|positive
Puedes cumplir todas las exigencias, pero te aclaro no vas a lograr nada. No pierdas el tiempo el ICETEX es solo publicidad|negative
Buenas tarde soy pensionado de las fuerzas militares de Colombia estoy necesitando un crédito para mí hija  que va estudiar como puedo hacer  para inscribirla  gracias|positive
Cuando van a comenzar a aprobar los créditos? Tengo una solicitud desde el 3 de mayo es estudió!!! Que demora para aprobar un crédito.|neutral
Dicen que todos los semestres hacen cambios cuando van a aprobar subsidios con sisben para todas las modalidades DE CREDITO TU ELIJES  COMO ERA ANTES  y no solo para los de largo plazo .|neutral
Que significa créditos con subsidios?|neutral
Aplican los mismo TyC o aplicarán algún cambio?|neutral
Dicen que aprobaron más de tres mil créditos con subsidio ¿Pero dónde encuentro la lista de aprobados? Apliqué a uno de estos y en consulta de resultados aún sigue en estudio.|neutral
Vendrán a Puerto López?|neutral
Numero de asesor para.comunicarme|neutral
En este momento solo les pido una ayuda como lo he mencionado una luz en el camino ya que si la universidad me diera espera yo lo haría sería paciente y no sería tan insistente, me dicen por chat, por modo on y por todo lado que mi crédito está aprobado, pero la universidad sigue insistiendo que mientras les registre a ellos en estudio la única manera que pueda estudiar es pagando con recursos propios y no tengo no tengo esos recursos propios, mire hasta mi línea de crédito es por afectación económica, si tuviera los recursos no sería tan insistente yo solo necesito una ayuda una luz en el camino, quiero estudiar y la universidad me dice que hasta hoy tengo plazo de que o cambien mis marquillas o pague con recursos propios ya que el convenio no sirve de nada, solo necesito una ayuda no les pido nada más.|negative
Porque no amplían el plazo? ??|negative
Las ganas de estudiar y superarse académicamente sobran, lo que no hay es oportunidades. He iniciado mí carrera universitaria por mis propios medios, ya he postulado  desde mí primer semestre 3 codeudores que no están reportados, sin ningún embargo con buena vida crediticia. Nunca han sido aceptado por ICETEX solo queda la duda de saber el porqué está respuesta a qué criterio hacen las verificaciones de los codeudores. Es desgastante poder acceder a estos créditos universitarios sin oportunidades. Es triste abandonar una carrera universitaria por la falta de recursos económicos.|neutral
#IcetexTeArruina no hay atencion dicen de temas de concodnacion y no hay soluciones necesito urgente solucionar mi tema con uds|negative
Si un estudiante tiene crédito condonable por generación e de excelencia y reúne los requisitos para generación e de equidad, pero quiere conservar el crédito condonarle lo puede hacer?Es decir puede negarse a pasarme a equidad?|neutral
Buenas tardes para este programa de más colombianos que nunca hay condonación si se ingresa en el 2 semestre |positive
Buenos días como puedo solicitar un cambio de mi linea de 20% a una de 100%gracias|positive
próximo 8 de junio de 2021, ICETEX notificará los resultados de esta asignación de subsidios a los usuarios de crédito postulados.|neutral
Me postule en la convocatoria de mayo y aún no dan respuesta|negative
