texto|categoria
¡Icetex no cumple!.. 5 meses luego de una aprobación de ampliación y no me han desembolsado el monto de ampliación aprobado. ¡Han sido demasiado negligentes conmigo!|negative
Nunca pidan crédito con esta Institución, tienen muy mala atención, los asesores se burlan de ti, te niegan la radicación de quejas, te obligan a llenar requisitos interminables, y en general hacen todo lo posible por no atenderte. La plataforma de el ICETEX es perversa, no está actualizada y tiene problemas en cada uno de los formularios; el ICETEX no envían las facturas a tiempo y las que están en la plataforma de estado de cuenta no están al día, entonces nunca sabes cuánto realmente estás debiendo. Es mejor pedir un crédito con un banco que con este desastre de institución.|negative
Quiero un crédito gracias saludos desde Barrancabermeja Santander Colombia sur América|positive
Nunca pidan crédito con esta Institución, tienen muy mala atención, los asesores se burlan de ti, te niegan la radicación de quejas, te obligan a llenar requisitos interminables, y en general hacen todo lo posible por no atenderte. La plataforma de el ICETEX es perversa, no está actualizada y tiene problemas en cada uno de los formularios; el ICETEX no envían las facturas a tiempo y las que están en la plataforma de estado de cuenta no están al día, entonces nunca sabes cuánto realmente estás debiendo. Es mejor pedir un crédito con un banco que con este desastre de institución.|negative
Nunca pidan crédito con esta Institución, tienen muy mala atención, los asesores se burlan de ti, te niegan la radicación de quejas, te obligan a llenar requisitos interminables, y en general hacen todo lo posible por no atenderte. La plataforma de el ICETEX es perversa, no está actualizada y tiene problemas en cada uno de los formularios; el ICETEX no envían las facturas a tiempo y las que están en la plataforma de estado de cuenta no están al día, entonces nunca sabes cuánto realmente estás debiendo. Es mejor pedir un crédito con un banco que con este desastre de institución.|negative

Nunca pidan crédito con esta Institución, tienen muy mala atención, los asesores se burlan de ti, te niegan la radicación de quejas, te obligan a llenar requisitos interminables, y en general hacen todo lo posible por no atenderte. La plataforma de el ICETEX es perversa, no está actualizada y tiene problemas en cada uno de los formularios; el ICETEX no envían las facturas a tiempo y las que están en la plataforma de estado de cuenta no están al día, entonces nunca sabes cuánto realmente estás debiendo. Es mejor pedir un crédito con un banco que con este desastre de institución.|negative

Buenos días una pregunta en el formulario de descripción aparece solo enfermería y son 8 semestres y me  inscribí a la universidad cooperativa para auxiliar de enfermería y solo es 3 semestres entonces como hago para  llenar el formulario del icetex y por preguntarle  si le dan el sostenimiento gracias|positive
Buenos días. Yo estoy y que preinscrito, necesito saber cómo estoy?|positive
Buenos días una pregunta es que en la convocatoria de línea de padres de 2021 pago de pensiones y un dato me quedo mal será que lo puedo arreglar|negative
Buenas tardes, me gustaría saber si la línea de generación e (excelencia) entra en esta línea o habrá una especial para ella?|positive
La línea de protección constitucional está en la línea de créditos que van a abrir ???|neutral
Nunca pidan crédito con esta Institución, tienen muy mala atención, los asesores se burlan de ti, te niegan la radicación de quejas, te obligan a llenar requisitos interminables, y en general hacen todo lo posible por no atenderte. La plataforma de el ICETEX es perversa, no está actualizada y tiene problemas en cada uno de los formularios; el ICETEX no envían las facturas a tiempo y las que están en la plataforma de estado de cuenta no están al día, entonces nunca sabes cuánto realmente estás debiendo. Es mejor pedir un crédito con un banco que con este desastre de institución.|negative
Soy bachiller técnico industrial,  y estoy prestando el servicio militar en la infantería de marina,  quiero continuar la carrera de suboficial que necesito para el crédito? Gracias|positive
Cual es la fecha para solicitar creditos 2021-2|neutral
Buenos dias. La pregunta es que en el formulario de solicitud y condiciones de adjudicacion quien debe firmar. |positive
Buenas noches. Quiero hacer una pregunta. En el formulario de solicitud de crediro y condiciones de adjudicacion de credito quien debe firmar si el beneficiario es menor de edad.|positive
Como podría uno acceder a dichos incentivos por excelencia académica?|positive
Y para cuando los giros de sostenimiento? Comunidad Ser Pilo Paga |neutral
Nunca pidan crédito con esta Institución, tienen muy mala atención, los asesores se burlan de ti, te niegan la radicación de quejas, te obligan a llenar requisitos interminables, y en general hacen todo lo posible por no atenderte. La plataforma de el ICETEX es perversa, no está actualizada y tiene problemas en cada uno de los formularios; el ICETEX no envían las facturas a tiempo y las que están en la plataforma de estado de cuenta no están al día, entonces nunca sabes cuánto realmente estás debiendo. Es mejor pedir un crédito con un banco que con este desastre de institución.|negative

Cuando abren convocatoria para comunidades indígenas para esté semestre 2021-1.??|neutral
Para cuando solucionan a mi hija lo de la condonación,ya hemos esperado mucho.|positive
Y cuando desembolsan a los que ya hemos renovado??|neutral
Nunca pidan crédito con esta Institución, tienen muy mala atención, los asesores se burlan de ti, te niegan la radicación de quejas, te obligan a llenar requisitos interminables, y en general hacen todo lo posible por no atenderte. La plataforma de el ICETEX es perversa, no está actualizada y tiene problemas en cada uno de los formularios; el ICETEX no envían las facturas a tiempo y las que están en la plataforma de estado de cuenta no están al día, entonces nunca sabes cuánto realmente estás debiendo. Es mejor pedir un crédito con un banco que con este desastre de institución.|negative

Buenas tardes, estoy denunciando formalmente al Icetex, por falta de respuesta a mi proceso de condonacion|positive
En adelante no ha sido posible aclarar, a pesar de las múltiples comunicación, radicación de casos y finalmente un derecho de petición radicado en marzo 5 de 2021, hoy es 7 de abril y no ha sido posible una respuesta,...|negative
indicaron que llamara al 7467018 para solicitar un alivio financiero por Covid 19, mientras dan respuesta al derecho de petición, y no solucionan nada, desde el martes 6 de abril he durado alrededor de 4 horas comunicando:  me envían de un lado para otro, no saben nada, que llame a una linea de ahi a otra y la devuelven, en fin una FALTA DE RESPETO TOTAL|negative
Recibi a inicios del mes de octubre un mensaje del funcionario Andres Felipe Foprero Villamil - Vicepresidencia Fondos de Administracion, sobre la ampliación de la fecha de recepción de documentos, a noviembre 30 de 2020|neutral
Envie la documentación el 2 de noviembre de 2020, rango autorizado, segun radicado 9308206, del cual se confirmo la recepcion de los mismos|neutral
Teníamos una fecha de recepción de documentos como requisito pata la condonación 30 de octubre de 2020|neutral
Hice en 2020 un programa con MInTic Inteligencia Articifial, lo culmine exitosamente...|neutral
Estoy desesperada por la falta de comunicacion,|negative
El agravante es que me han enviado la cuenta de cobro, primera cuota a pagar en abril 5 de 2021 y NO debo nada|negative
En que universo es eso? Hasta donde he experimentado con ICETEX, lo unico que hacen es robarle el dinero cancelado a los estudiantes y seguir aplicando intereses sobre intereses y evadir cualquier tipo de aclaracion de informacion al usuario a fin de dilatar los procesos y continuar generando saldos pendientes. No procesan los retornos como retornos, la informacion proporcionada con el sistema nunca coincide, los pagos no aparecen, el sistema de PQRs es obsoleto, tienen asesores desinformados que no proporcionan soluciones y son los asesores del NO PUEDO cuando de solicitud de informacion y aclaracion se trata, y las respuestaa emitidas por todos los medios son genericas, no resuelven nada, sin sentido comun y para nada responden a las solicitudes realizadas. Debo decir que ICETEX ha sido la peor experiencia de todas y roban el dinero de los usuarios.|negative
Nunca pidan crédito con esta Institución, tienen muy mala atención, los asesores se burlan de ti, te niegan la radicación de quejas, te obligan a llenar requisitos interminables, y en general hacen todo lo posible por no atenderte. La plataforma de el ICETEX es perversa, no está actualizada y tiene problemas en cada uno de los formularios; el ICETEX no envían las facturas a tiempo y las que están en la plataforma de estado de cuenta no están al día, entonces nunca sabes cuánto realmente estás debiendo. Es mejor pedir un crédito con un banco que con este desastre de institución.|negative

Esto es una gran mentira , no entiendo por que engañan a los estudiantes desde el semestre pasado fui aceptada para el subsidio , nincun banco les sirve , siempre es la misma excusa que el banco no recibe el giro , cambie de banco a solicitud de ustedes y nada de nada y ahora llega un correo que tampoco que no sirve la cuenta , enviado mi certificacion 6 veces siempre me dicen 15 dias y van 9 meses y ni el del semestre pasado ni este ... si realemnte eso es mentira pues digan y deja uno de perder el tiempo .|negative
Cuando abren nuevamente las convocatorias?|neutral
Como cambia ahora los grupos con referente al sisben para recibir condonación y subsidios?|neutral
Entonces los que tenemos el subsidio de sostenimiento también aplicaríamos al incentivo por excelencia|positive
Dónde podemos encontrar más información?|neutral
En que universo es eso? Hasta donde he experimentado con ICETEX, lo unico que hacen es robarle el dinero cancelado a los estudiantes y seguir aplicando intereses sobre intereses y evadir cualquier tipo de aclaracion de informacion al usuario a fin de dilatar los procesos y continuar generando saldos pendientes. No procesan los retornos como retornos, la informacion proporcionada con el sistema nunca coincide, los pagos no aparecen, el sistema de PQRs es obsoleto, tienen asesores desinformados que no proporcionan soluciones y son los asesores del NO PUEDO cuando de solicitud de informacion y aclaracion se trata, y las respuestaa emitidas por todos los medios son genericas, no resuelven nada, sin sentido comun y para nada responden a las solicitudes realizadas. Debo decir que ICETEX ha sido la peor experiencia de todas y roban el dinero de los usuarios|negative
Bueno y para los que hace mucho tiempo tenemos una cuenta CATS activa cuando nos van a pagar el subsidio de sostenimiento 2020-2? Dificultades tenemos, contratiempos también porque ustedes cada que uno llama o se comunica por cualquier medio la respuesta es diferente. HASTA CUÁNDO TENEMOS QUE ESPERAR QUE NOS PAGUEN EL SUBSIDIO? QUE SE TIENE QUE HACER PARA QUE PAGUEN?|neutral
Buen día, cuando al poner todos los datos  y le doy en radicar me sale el mensaje de: la cuenta de AHORROS ya se encuentra inscrita, eso quiere decir que ya está activada?|positive
Deberían optimizar mejor la información,  llevo 6meses esperando una respuesta concreta ,|negative
Buenos días, quisiera saber cuando abren las convocatorias para protección constitucional porfavor. Muchas gracias|positive
Es imposible comunicarse con ustedes. Necesito información. De un crédito para policía patrullero.y no me contestan de ninguna parte como puedo tener comunicación.gracias|neutral
Cómo hacer parte?me podrían dar información|neutral
Hasta cuando más tenemos que esperar el giro de sostenimiento llevo 3 meses esperando|neutral
Buenas tardes  xfavor me podría informar cuál es el proceso para los estudiantes que aplican a generación E? Mí hijo aplica pero no le permite abrir la página muchas gracias|positive
Buenas tardes desde el 15 de marzo tengo registrada mi cuenta, ya que me encuentro beneficiario al 2020 _ 1 y a la fecha no he recibido el giro de sostenimiento, he llamado y consultado por chat, y siempre tengo respuestas distintas, quisiera saber si en realidad se hara tal giro. Ya que por lo que veo habemos varias personas con el mismo interrogante.|positive
buena tarde, saben cuándo habrá convocatoria para el crédito tú eliges para 2021-2?|positive
les comento no me deja ni en pdf gracias quedo atentoo|positive
Mmm nada que pagan el subsidio|neutral
Tengo una pregunta como se solicita ese giro de sostenimiento ? |neutral
Hola, estoy en estado jurídico viable y pasaron ya más de 15 días hábiles para que me consignen el apoyo de sostenimiento y nada.|positive
Buenas noches, ¿cuándo vuelven a abrir convocatoria de crédito para pregrado línea 25%, apoyo y sostenimiento?|positive
Gracias por la informacion que ustedes me han brindado. ¿Los crediros para victimas de proteccion constitucional si se puede acceder.|neutral
Buenos dias los creditos de sostenimiento  para universidades privadas se puede acceder gracias.|positive
Buenas tardes,mi hija fue admitida en la catolica de manizales.resulta que tiene problemas con el celular y no le llego sobre esta información,y nosotros necesitamos pedir este crédito hace unos días estuve en el icetex y me orientaron sobre los créditos, me metí a lo de créditos me preinscribi y quedo de llegarme más información del proceso al correo y aún no e recibido nada.me urge hacer todo este proceso espero respuesta gracias|positive
Buenos días como se hace para ser beneficiario de un crédito|neutral
En realidad los procesos son muy demorados,A pesar de ya estar aprobado la legalización es un proceso muy largo que tarda meses y las universidades no dan espera,Haciendo que se pierda el dinero de la inscripción o incluso la admisión a la U,Los convenios son muy malos,Nos sirven para nada por qué igual piden el pago,Si se solicita un crédito es porque no se tiene dinero, ademas con esas tasa de interes!!!|negative
ICETEX= Entidad encargada de gastar el dinero que otros esperan, a causa de su propaganda. Pueden desembolsar 19.000 millones algo que no sirve mientras las personas y universidades esperan por el pago de un crédito aprobado sin fondos.|negative
Estoy apunto de perder mi oportunidad de comenzar mis estudios por culpa de la demora en los procesos,Aparte los dichosos convenios que dicen tener no sirven de nada,Ya que a pesar de aplicar a una universidad convenio esa universidad me pide el pago del primer semestre para asegurar un cupo,Es claro y casi obvio que si se pide un crédito es porque no se cuenta con el dinero en el momento.Es muy desalentador saber que no se apoya la educación por ningún medio.|negative
Mi hermano Esta apunto de perder mi oportunidad de comenzar mis estudios por culpa de la demora en los procesos,Aparte los dichosos convenios que dicen tener no sirven de nada,Ya que a pesar de aplicar a una universidad convenio esa universidad me pide el pago del primer semestre para asegurar un cupo,Es claro y casi obvio que si se pide un crédito es porque no se cuenta con el dinero en el momento.Es muy desalentador saber que no se apoya la educación por ningún medio.|negative
Camilo Molano Esta apunto de perder mi oportunidad de comenzar mis estudios por culpa de la demora en los procesos,Aparte los dichosos convenios que dicen tener no sirven de nada,Ya que a pesar de aplicar a una universidad convenio esa universidad me pide el pago del primer semestre para asegurar un cupo,Es claro y casi obvio que si se pide un crédito es porque no se cuenta con el dinero en el momento.Es muy desalentador saber que no se apoya la educación por ningún medio.|negative
En realidad los procesos son muy demorados,A pesar de ya estar aprobado la legalización es un proceso muy largo que tarda meses y las universidades no dan espera,Haciendo que se pierda el dinero de la inscripción o incluso la admisión a la U,Los convenios son muy malos,Nos sirven para nada por qué igual piden el pago,Si se solicita un crédito es porque no se tiene dinero.|negative
Tanto que ofrecen inpulsatones y miles de cosas para uno acceder a un crédito y en en este momento por demoras en el proceso estoy perdiendo la oportunidad de iniciar a estudiar, no es justo que si se solicita un crédito por la demora de los pasos de los mismo, las universidades con  convenio  exijan pagos, si se supone que si uno realiza un proceso de crédito es porque no tiene como pagar, siento que mi derecho a la educación está siendo vulnerado por demoras en los proceso de icetex y aún peor los convenios para los que ingresan a primer semestre no sirven de nada, en este momento me siento desilusiónado de icetex y mi sueño frustrado.|negative
Porque no  tienen diálogo directo con las universidades en la que la persona va a empezar su formación profesional? Que vaina esa de jugar con los sueños de la gente, se pierde la oportunidad de un cupo en una universidad, porque el icetex no desembolsa rápido, no brinda más opciones, no dialoga con la universidad pertinente, no se entra a mediar al benificio del implicado, se necesitan respuestas.|negative
Si los procesos son muy demorados mi hijo también perdió la oportunidad por tanta demora  yo les pido el favor q sean más rápidos en los procesos yo llevo luchando por un crédito año y medio no es justo cuando ya se tenía todo se cerró la plataforma y me quedé por fuera dela convocatoria de primer semestre|negative
Tanto que ofrecen inpulsatones y miles de cosas para uno acceder a un crédito y en en este momento por demoras en el proceso estoy perdiendo la oportunidad de iniciar a estudiar, no es justo que si se solicita un crédito por la demora de los pasos de los mismo, las universidades con  convenio  exijan pagos, si se supone que si uno realiza un proceso de crédito es porque no tiene como pagar, siento que mi derecho a la educación está siendo vulnerado por demoras en los proceso de icetex y aún peor los convenios para los que ingresan a primer semestre no sirven de nada, en este momento me siento desilusiónado de icetex y mi sueño frustrado.|negative
Para que exiaten los convenios si dejan a los jovenes sin la oportunidad de estudiar ??|negative
Esto es publicidad barata y falsa que solo ilusionan a las personas ??????  que quieren estudiar.   Solo es estafa  no caigan por favor|negative
Para después termina pagando 3 veces lo que vale la carrera, y eso sí es que se entra a estudiar, por qué como se demoran tanto en desembolsar, paso a la universidad y no dan el crédito.|positive
Son la peor No recomiendo a nadie mi hijo a 5 meses de graduarse y no an consignado lo del crédito q se hizo??????y lo peor ya dicen q no se puede cancelar el crédito...pero tampoco lo giran ??????lo peor icetex ,no se metan con esta entitad. Son lo peor|negative
Son lo peor|negative
Son lo peor|negative
Estoy apunto de perder mi oportunidad de comenzar mis estudios por culpa de la demora en los procesos,Aparte los dichosos convenios que dicen tener no sirven de nada,Ya que a pesar de aplicar a una universidad convenio esa universidad me pide el pago del primer semestre para asegurar un cupo,Es claro y casi obvio que si se pide un crédito es porque no se cuenta con el dinero en el momento.Es muy desalentador saber que no se apoya la educación por ningún medio.|negative
Estoy apunto de perder mi oportunidad de comenzar mis estudios por culpa de la demora en los procesos,Aparte los dichosos convenios que dicen tener no sirven de nada,Ya que a pesar de aplicar a una universidad convenio esa universidad me pide el pago del primer semestre para asegurar un cupo,Es claro y casi obvio que si se pide un crédito es porque no se cuenta con el dinero en el momento.Es muy desalentador saber que no se apoya la educación por ningún medio.|negative
ICETEX para cuándo la convocatoria de créditos condonables de víctimas del conflicto Armado?|negative
Tanto que ofrecen impulsatones y miles de cosas para uno acceder a un crédito y en en este momento por demoras en el proceso estoy perdiendo la oportunidad de iniciar a estudiar, no es justo que si se solicita un crédito por la demora de los pasos de los mismo, las universidades con  convenio  exijan pagos, si se supone que si uno realiza un proceso de crédito es porque no tiene como pagar, siento que mi derecho a la educación está siendo vulnerado por demoras en los proceso de icetex y aún peor los convenios para los que ingresan a primer semestre no sirven de nada, en este momento me siento desilusiónado de icetex y mi sueño frustrado.|negative
Estoy apunto de perder mi oportunidad de comenzar mis estudios por culpa de la demora en los procesos,Aparte los dichosos convenios que dicen tener no sirven de nada,Ya que a pesar de aplicar a una universidad convenio esa universidad me pide el pago del primer semestre para asegurar un cupo,Es claro y casi obvio que si se pide un crédito es porque no se cuenta con el dinero en el momento.Es muy desalentador saber que no se apoya la educación por ningún medio.|negative
Totalmente de acuerdo no se  me dió la oportunidad de estudiar  ???? ya que no me brindaron la oportunidad   de emprender mis sueños  y por eso me quede sin  estudiar ??|negative
De qué sirve tanta convocatoria a créditos fondos y becas, si cuando la persona es admitida en la universidad, este cupo se pierde por culpa procesos tardíos de desembolsó del icetex|negative
Totalmente de acuerdo no se  me dió la oportunidad de estudiar  ???? ya que no me brindaron la oportunidad   de emprender mis sueños  y por eso me quede sin  estudiar ??|negative
De que sirve que ofrezcan convenios y un sinfín de cosas para poder estudiar si el proceso se vuelve lento y la oportunidad se pierde por su demora y falta de comunicación ante la solicitud.|negative
Totalmente de acuerdo no se  me dió la oportunidad de estudiar  ???? ya que no me brindaron la oportunidad   de emprender mis sueños  y por eso me quede sin  estudiar ??|negative
Son lo peor|negative
Son lo peor ??????no lo recomiendo mi hijo a 5 meses ya de graduarse y nunca consignaron su crédito...lo queremos cancelar y no se puede dicen q fue aprobado ??????no se puede cancelar pero no giran...no lo recomiendo si un fraude|negative
Mejor una feria virtual, hay quienes no podemos andar de feria en feria ??|positive
Una amiga sacó un prestamo para pagar su pregrado en una universidad pública. Hace dos años acabó el doctorado y aún no termina de pagar la deuda. ?? ICETEX es un robo.|negative
Llamadas que agobian ..... usted tiene una deuda, usted tiene una obligacion!! Claro que si, quien dice que no. Pero cuando uno no tiene como pagar..... les vale c..lo siguen subiendo interes y no congenlan el prestamo y sigue subiendo.. y siguen cobrando. Aaahhh pero usted debe pensar antes de pedir el prestamo.. vaya respuesta la que me dieron.|negative

Este es el ICETEX del estado pero no para el pueblo.|negative
Y eso en qué afecta el cambio climático?|neutral
Ventana??? Estafadores si seran.|neutral
Yo también después de mucha lucha logré q mi hijo estudia medicina los sueños si son posibles si nos esforzamos tú cómo muchos jóvenes también lo pueden lograr|negative
Dónde están los resultados de la convocatoria artistas jóvenes talento? Dónde está la transparencia de esta institución? Por qué una entidad que maneja  recursos para la educación de los colombianos esconde los resultados que involucran cientos de miles de dólares? |positive
Seria el colmo Cobrar por lo que no hacen y sirven|negative
Buenos días,El 19 de Julio eran los resultados de la beca de artistas jóvenes talentos. ¿Dónde podría ver los resultados o saber si pasé o no?He escrito varios correos a becas@icetex.gov.co y jovenestalentos@icetex.gov.co y no he recibido respuesta. También he escrito al chat que tienen en la página y tampoco he recibido alguna información.No sé quién pueda saber acerca del tema o dónde me podría comunicar.Espero poder conseguir una respuesta.Quedo atento.Muchas gracias.|neutral
Hola estimados, cuánto tiempo puede tardar el correo para firmas de garantías? Una vez que dice Legalizado IES?|neutral
¡Los esperamos en nuestro Campus Av. Universitaria!|neutral
Comencé a laborar y al mes me hicieron retención salarial llegue a un acuerdo para cancelar y ahora la empresa a un continua con la retencion salarial y ustedes cobrandome la cuota, estoy pagando mensualmente 700 mil pesos hace 4 meses y mi salario es de 1.050.000 ¿dígame usted si eso es justo?|negative
Icetex es una institución que se aprovecha de las necesidades de los padres de familia y jóvenes ulnerables que desean que sus hijo estudien y acuden a créditos ,pero este instituto no es una ayuda es una exploración a los más vulnerables,aparecen cobrando lo que ya se pagó el y sinel estudiante refundido documentos pues le caen pagar y si el estudiante saca un crédito para pagar más rápido y más económico lo roban cobrando hasta cuatro millones más ,estoy viviendo esa situación ,no le recomiendo a nadie este medio de crédito.|negative
¡Los esperamos a todos!|neutral
Que gran mentira eso, si impulsarán el futuro de verdad que en este momento no estaría perdiendo la oportunidad de estudiar, esos  convenios no sirven de nada para los de primer semestre.. desilusión total!! ??|negative
si alguien atiendera en esta empresa seria bueno.|positive
