texto|categoria
indolentes yo tengo una enfermedad que conlleva a discapacidad laboral y no me condonan|negative
Ojo con las becas condonables. Cantidad de Maestros de I. E., participamos de unas becas otorgadas por el programa Fondo Excelencia Docente del MEN, en el 2016, cumplimos con todos los requisitos para la condonación  de la beca y al día de hoy nos están cobrando. Siendo que el dinero está y para eso fue creado el fondo  Mucho cuidado ??.|negative
Buenas tardes, tengo una situación con el icetex, me están cobrando una beca para una maestría que llevé a cabo en el 2016-2018, de becas para la excelencia docente; según ellos, dizque no cumplo con los requisitos. Envié todo en el tiempo estipulado, con los documentos contemplados en el Convenio Interadministrativo No. 1156 de 2017, con el objeto Constituir un Fondo en Administración para fomentar la Excelencia Docente de Preescolar, Básica y Media en Programas de Maestría, mediante el ofrecimiento de créditos condonables y ahora me están cobrando todo el valor de la beca. Por favor me dan información sobre esto. Gracias.|positive
Buenas noches. Una pregunta los crediros de O% estan activos.|positive
Donde se puede renovar el auxilio para el proximo semestre??|neutral
El gobierno dio ayudas económicas a todos los sectores del país. Los único que no hemos tenido ningún beneficio económico, somos nosotros los usuarios del icetex. Deberían de dar alivios reales, condonación de la deuda por ejemplo.|neutral
Para personas víctimas del conflicto armado que beneficios hay ?|negative
Debo más de 10 millones, hace más de tres años no pago porq estaba estudiando... puedo volver a iniciar a pagar cuotas  normales.|negative
No más Icetex. Viva el paro nacional.|neutral
Si No tienes un fiador, que a ellos les  agrade, no te prestan , no un centavo.|negative
Número en Cali para comunicarme? ??|neutral
Donde atenderán para la feria que habrá en Pereira|neutral
Señores ICETEX Buenas tardes, mensualmente me envían la factura a mi correo y esta vez no lo han hecho, he entrado a Mi Estado de Cuenta y en la opción de última factura me sale la del mes pasado; oportunamente pagada. Quiero saber porque no se me ha generado la factura, y ojalá eso no signifique luego el pago de intereses.|positive
Buenas noches. El credito de proteccion constitucionalpara victimas se encuentra cerrado. Y que creditos se puede solicitar y hasta cuando.|neutral
Buenos días solicito información sobre un trámite, y ayuda con unos inconvenientes que he presentado, desafortunadamente en la línea es imposible la comunicación, gracias ??|positive
Nunca me solucionaron mi caso con respecto a la aprobación que me hicieron de la ampliación, se pasaron enviándome documentos y documentos donde dice que mi giro ha sido aprobado, respondiendome incoherencias y lo más inaudito, se la pasan de 15 días hábiles en 15 días HÁBILES Dandonme una respuesta X, y nunca me dan solución, he pasado derecho de petición más un recurso de apelación y nada!.. ¡Definitivamente ya es demasiada negligencia y atropello con el usuario!|negative
No me ha llegado el subsidio y a muchos compañeros si.|negative
Solo me llego la mitad del desembolso.|negative
Si hasta ayer me llego el correo para inscribir la CATS cuando llega el subsidio?|neutral
Buenas tardes, solicitamos ayuda ya que se hizo todo el trámite para un crédito se subieron todos los documentos y no nos han solucionado.|positive
No ha llegado el subsidio|negative
Steven Casañas  en ese caso creo que tocó acudir a la tutela o en su defecto hablar con nuestro abogado|negative
Buenas noches, Cuando llega el giro de sostenimiento ??|positive
Estoy tratando de abrir la cuenta y nada ? No me deja subir archivos|negative
Quien me puede ayudar para hacer una transferencia de una universidad a otra estoy con icetex |positive
Hola buenas necesito accesoria para anular un crédito|positive
Buenas cómo puedo acceder a un crédito|positive
Buenas necesito accesoria|neutral
Necesito anular un crédito y no tengo accesoria|neutral
Buenos días, una pregunta, este programa solo para hijos de empleados? Si yo soy empleada no tengo la posibilidad de aplicar?|positive
Son unas ratas dirá|negative
Atrasarse en icetex es más peligroso que deberle al pago diario y a cualquier banco en Colombia.|negative
No entiendo como existe una entidad como  el icetex asfixiando a cuotas económicas  a quienes quieren salir adelante, en un país donde se pierden más de 50 billones de pesos al año en corrupción ????????????????????|negative
Que se necesita para tener este beneficio|positive
Buenas tardes nesecito un crédito para mi hijo pero no tengo codeudor|positive
A una persona como yo que estoy finalizando técnico administrativo en el instituto técnico cofrem y me interesa homólogas y seguir estudiando administración de empresas será que me prestan?|positive
Buenas disculpe para que fecha empiezan a pagar el subcidio de sosteniendo?|positive
Hola buenas una pregunta sin agenda cita uno puede acercarse para que le den toda  la información?|positive
Solo será para los usuarios o tambiénlos jóvenes interesados en información podrán asistir?|neutral
Hola cuándo comienzan a aprobar los créditos?|neutral
Cuando en Cali?|neutral
Para cuándo hacen feria en Neiva|neutral
Sería bueno que le den a uno a escoger la opción de auxilio que más le sirve, y no que se la impongan ????|positive
ICETEX esto es una medida automática? o hay que llamar o solicitarlo en la pagina web? En el estado de cuenta aún no aparece la opción Auxilios COVID-19.|neutral
Yo poseo el auxilio por covid, osea que este me lo ampliaran hasta diciembre?|neutral
Por que cerraron la convocatoria de protección constitucional tan rápido? Muchas universidades no han dado la lista de admitidos aún|positive
No más Icetex, ratas.|negative
Algun  correo para una consulta sobre mi linea de credito a que correo puedo escribir ?|neutral
Jajajaja gratis pero piden mas que demen|positive
Pues aquí en san Andrés nos toca con tramitadores o ex trabajadoras del icetex que sepan hacer las cosas porque las que están en la oficina escasamente lo quieren atender a uno y nunca saben nada o no tienen sistema.|neutral
Cuando hay convocatoria para el fondo de víctimas?|neutral
conocen alguna página más enredada y dificil de consultar que la del ICETEX ??? Puede que sea gratis, pero la interfaz es tan complicada que una persona del comun nopodria con ese enredo de pagina |negative
Sera que los puedo denunciar a usd mismos por sus intereses. O a este pais por la escasa oferta laboral que hay para que estudiar y endeudarse con una entidad que son unos avaros con intereseses sumamente altos.....|negative
En la cita que dan telefónicamente dan una dirección diferente a la Universidad Andina, lo mismo en el correo que me enviaron...me imagino que la correcta es la de la imagen.|positive
Fecha para fondo de víctimas|neutral
Para cuando la.convocatoria de indigenas|neutral
Los subsidios antes de la reforma que le hicieron en el 2016 aplicaban a toda clase de líneas de crédito que tuvieran SISBEN  pero ahora solo para líneas de crédito de 0 10 y 25%, no benefician a 40 y 60   que tristeza que cada vez reduzcan más la gente que se puede beneficiar.|negative
ICETEX es una farza, sacan supuesta linea de creditos para el pago de pension de jardines y colegios privados ni siquiera se toman e tiempo de revisar las solicitudes ??|negative
¿Como es el proceso para poder acceder a un préstamo para la Educación superior , siendo menor de edad?|neutral
Buenos días, aplica para la  educación para el  trabajo y desarrollo?|positive
Ofrecen 9.000 cupos y se presentan muchísimo más que eso 9mil osea que muchas personas pierden el beneficio por la poca cobertura que hay|negative
Julian Andres Toro Escobar  Laura Victoria Escobar Moncaleano ya empezaron las convocatorias|neutral
Cómo accedo a esta oferta|neutral
Las propias ratas. |negative
Yo aún esperando la convocatoria de comunidades indígenas y nada que sale para este semestre 2021-2|neutral
Unidades Técnicas Del Oriente Patricia Ortiz |neutral
Como no estar al día, si se está de vaina no te quita la vida.|negative
Hijos de puta|negative
No puedo creer que digan que su atención es ágil, ya que, en septiembre radique los soportes para la condenación de una crédito beca (fondo de excelencia docente) y no le dieron respuesta. Volví a radicarlos en febrero y las respuestas que generan es una carta con los requisitos que se deben tener. Llama uno y escalanel caso y vuelven a responder con lo mismo.  Es una negligencia tenaz y ya uno no sabe que hacer para que respondan ??|negative
Buenas noches. Una pregunta los creditos para la linea proteccion constitucional para victimas ya se encuentra habilitado. Muchas gracias.|neutral
Cuál aveses le dan la información mal|negative
hola, una pregunta, ayer 19 de mayo hubo una reunion webinar, no pude asistir por problemas de conexion, pero me gustaria saber que tipo de documentos son requeridos para la solicitud de credito, es urgente porfavor.|positive
Excelente, iniciativa|positive
Los subsidios aplican para especialización ???|neutral
si estoy reportada en centrales de riesgo datacredito  puedo acceder a un credito educativo de educacion superior?|negative
necesito ayuda... la semana pasada subí mis documentos para la legalización pero no los han revisado. que debo hacer?|positive
hola, una pregunta, ayer 19 de mayo hubo una reunion webinar, no pude asistir por problemas de conexion, pero me gustaria saber que tipo de documentos son requeridos para la solicitud de credito, es urgente porfavor.|positive
Esto ya existía, por qué más bien no dicen por qué están cerrando este beneficio cuando no han comenzado las matrículas?? Les recortaron el presupuesto de la educación para indígenas, victimas y negritudes??? Digan la verdad|neutral
Los subsidios antes de la reforma que le hicieron en el 2016 aplicaban a toda clase de líneas de crédito que tuvieran SISBEN  pero ahora solo para líneas de crédito de 0 10 y 25%, no benefician a 40 y 60   que tristeza que cada vez reduzcan más la gente que se puede beneficiar.|negative
Qué miedo meterse en semejante suicidio. Sería más seguro venderle el alma al demonio que hacer cualquier trámite con esta nefasta entidad.|negative
F Por los que se endeudaron de por vida con esos creditos|negative
Hola buenos diaz bendiciones, como hago para postularme a esta convocatoria?|neutral
El Icetex no hace préstamos años jóvenes que ban a ser curso de patrullero|negative
Aun no sale la convocatoria de comunidades indígenas para este periodo 2021-2|neutral
Com puedo acceder a esta convocatoria... lo necesito|neutral
Cuando abren la convocatoria de protección constitucional??|neutral
Ojalá en esto no prometan subsidios que son mentira, para que los estudiantes terminen casi rogando por ellos, es absurdo todo lo que he tenido que hacer para un subsidio de sostenimiento y me engañaron y se burlaron de la peor manera, haciéndome enviar correo y certificados bancarios que a los únicos que no les recibe el dinero es a ustedes, me hicieron cambiar mi cuenta tradicional por que esa supuestamente no servía, lo hice por el medio que ustedes solicitaron y tampoco ? Es absurdo ... dejen de burlarse de los estudiantes|negative
HIJOS DE PUTA??????????????????????????|negative
De que se trata esto?|neutral
Tan raro ! Preciso hoy jajaja|neutral
Jajaja como que los tumbaron ??|positive
Ahora Paula llora todas las noches hasta quedarse dormida en la casa de sus padres, porque le debe el 90% de su sueldo a icetex|negative
Falso mi hijo solico un crédito hace 5 meses para financiar la carrera y esta es la fecha no  an desembolsado no los recomiendo|negative
Buenas noches, hasta cuando hay plazo de hacer la solicitud de crédito para el segundo semestre del 2021 ??  Gracias|positive
Cordial saludo. Una pregunta es necesario hacer la preinscripcion o se puede solicitar sin el credito sin hacer preincripcion y escoger el credito que me de mejores condiciones.|positive
Quiero saber más sobre esto|neutral
Para realizar la solicitud, ¿hay que hacer un pago?|neutral
Alguien me puede decir si una persona que estudia en educosta puede aspirar a las becas del Icetex ?|neutral
Buenas cuáles son los requisitos para aseder a un cerdito estudiantil|positive
No caigan en esta trampa,ICETEXTEARRUINA|negative
Buenos días, el validador para registrarse en crédito de idiomas no está funcionado. No permite avanzar. Desde el viernes he intentado y no funciona. |neutral
Buenos dias por favor necesitó su colaboración estoy en la espera de su respuesta de  la solicitud que les hice ya hace mas de media hora por favor|neutral
Buenos días soy Kelly Yohana Lopez Acuña cédula 1121296896 en representación de la estudiante Sheyla yojana Cervantes Lopez tarjeta de identidad 1121541918 del liceo comercial del caribe hice la solicitud de los créditos 2021 para los colegios privados saliendo seleccionado para la fechado no me a llegado el correo para la legalización de los documentos le agradezco me colabore para poder diligenciar le pronto la solicitud gracias|positive
Necesito el crédito para el segundo semestre y me sugirieron esperar terminar semestre para hacerlo con el promedio, mi pregunta es cuanto demora el desembolso del dinero y si al tener que esperar hasta principios de junio no me afecta a la hora de otorgar créditos, me preocupa no alcanzar, gracias|negative
Ya esta abierta para generacion e excelencia 2021-2?|neutral
Ya realize la prescripción que mas hago|neutral
Para solicitar el credito para solicitar segundo semestre piden el promedio de notas. En el momento el promedio lo daran la primera semana de junio, toca esperar el promedio para solicitar el credito o se puede ir solicitando.|neutral
Hacen créditos para el curso de patrullero|neutral
Incluye fondo de víctimas ? |neutral
Necesito un crédito para la policia patrullero|neutral
Esta abierta tambien para la comomunidad indigena?|neutral
Yo llevo un mes esperando desembolso y nada|neutral
Me pueden regalar el link de inscripción gracias|positive
ICETEX, en la preinscripción no está la opción tarjeta de identidad, ni la Universidad Cooperativa de Colombia|negative
Marcela Falak Uribe Monsef |neutral
Empezó la otra convocatoria y aun nisiquiera me han desembolsado el crédito que hice .|negative
Carmen Sofia Bula Luzmila Ordosgoitia  ya |neutral
El formulario presente un erro cuando se va a diligenciar la parte del deudor sale error desconocido handle|negative
Personas con 29 años pueden ser beneficiados por icetex?|neutral
No caigan en este estafadero, las deudas de icetex son practicamente infinitas, es interes sobre interes y asi pagues puntual, todos los dias sube y sube el monto, es por experiencia propia|negative
Me comunique al interno por facebook y me dan la misma respuesta, ahora diganme que tengo que hacer ??|neutral
Desde inicios de este año estoy tratando de vincular mi cuenta bancaria para recibir el giro de sostenimiento que tengo pendiente del 2020, me he comunicado todos los dias desde esta fecha y envio correos donde me responden que ya esta vinculada la cuenta y me hacen esperar 15 dias habiles y al momento de consultar me aparece inscrita otra cuenta, no se en realidad que carajos pasa pero ya llevo muchisimo tiempo y no tengo una respuesta, he echo todo al pie de de la letra y no me hacen efectiva la vinculación, los asesores en la linea telefonica son lo mismo, parece que les pagaran por el optimismo pq siempre que dicen que todo esta perfecto que ya va a llegar el giro, cuando ni la vinculacion la hacen, entonces espero su respuesta pronta, gracias |negative
YA ESTOY CANSADO QUE ME DIGAN ESPERA 15 DIAS HABILES Y NO HACEN NADA Y LUEGO DICEN QUE ESPERE OTROS 15 DIAS HABILES, ASI YA LLEVO 4 MESES|negative
Son unos desvergonzados, llevo en una solicitud de crédito desde diciembre 2020 y por un trámite administrativo de ellos no me han dado respuesta. No tienen tiempos de gestión, no me dicen cuando me van a solucionar, es una burla para el usuario Súper financiera|negative
educación para el trabajo y desarrollo humano|positive
Malparidos icetex son unos hijueputas|neutral
Buenas noches me gustaría saber que grupo del sisben iv pueden ser beneficiado con generación e equidad|positive
Información negritomartinez0424@gmail.com |neutral
ICETEX llevo desde el 14 de diciembre del año 2020 esperando que me vinculen la cuenta de Bancolombia ahorro a la mano para hacer efectivo el giro de sostenimiento y ya llevo más de 4 meses recibiendo excusas de su parte por la vinculación de mi cuenta de bancaria para recibir los giros de sostenimiento, siempre me dicen que espere 15 días habiles, me envían correos que Ah sido efectiva la vinculación y no es cierto, o me vinculan otra cuenta, en fin llevo todo este tiempo esperando respuestas de ustedes, me comunico todos los días y me dicen lo mismo que tengo que esperar al área encargada, y yo me pregunto, será que todo esté tiempo no Ah sido suficiente, ya he esperado más de 5 veces 15 días hábiles y no hacen nada al respecto|negative
Buenas noches cuando se habren la convocatoria para solicitar credito 2021 - 2 muchas gracias ¿ que fecha?|positive
Donde puedo comunicarme para ser a tendida por un asesor|neutral
Buenas tardes me puedes brindar un número telefónico para crédito de especialización gracias|positive
no se vayan a meter con icetex son unas completas ratas de alcantarillas se hizo un acuerdo de pago hace mas de 15 dias y no han hecho nada para quitar las retenciones salariales, no se metan con icetex no lo hagan son muy ladrones|negative

Desde inicios de este año estoy tratando de vincular mi cuenta bancaria para recibir el giro de sostenimiento que tengo pendiente del 2020, me he comunicado todos los dias desde esta fecha y envio correos donde me responden que ya esta vinculada la cuenta y me hacen esperar 15 dias habiles y al momento de consultar me aparece inscrita otra cuenta, no se en realidad que carajos pasa pero ya llevo muchisimo tiempo y no tengo una respuesta, he echo todo al pie de de la letra y no me hacen efectiva la vinculación, los asesores en la linea telefonica son lo mismo, parece que les pagaran por el optimismo pq siempre que dicen que todo esta perfecto que ya va a llegar el giro, cuando ni la vinculacion la hacen, entonces espero su respuesta pronta, gracias|negative
Y las convocatorias de becas extranjeros en Colombia se volverán a reaperturar o por condiciones de covid-19 darán opciones alternativas para cursar estudios de posgrado en el futuro cercano|neutral
no se vayan a meter con icetex son unas completas ratas de alcantarillas se hizo un acuerdo de pago hace mas de 15 dias y no han hecho nada para quitar las retenciones salariales, no se metan con icetex no lo hagan son muy ladrones|negative
La primera Y la Mas Importante: Evita Icetex Porque ellos si te dejan en la quiebra y de por vida|negative
Tips para ahorrar dinero: Ni por el HijoDeUribe (porque las putas tienen más dignidad) pida un crédito en el usurero ICETEX.|negative
Tío numero 1: evitar ICETEX como la lepra :v|negative
Deseo saber sobre los tipos de crédito por favor icetex|neutral

Desde inicios de este año estoy tratando de vincular mi cuenta bancaria para recibir el giro de sostenimiento que tengo pendiente del 2020, me he comunicado todos los dias desde esta fecha y envio correos donde me responden que ya esta vinculada la cuenta y me hacen esperar 15 dias habiles y al momento de consultar me aparece inscrita otra cuenta, no se en realidad que carajos pasa pero ya llevo muchisimo tiempo y no tengo una respuesta, he echo todo al pie de de la letra y no me hacen efectiva la vinculación, los asesores en la linea telefonica son lo mismo, parece que les pagaran por el optimismo pq siempre que dicen que todo esta perfecto que ya va a llegar el giro, cuando ni la vinculacion la hacen, entonces espero su respuesta pronta, gracias|negative
no se vayan a meter con icetex son unas completas ratas de alcantarillas se hizo un acuerdo de pago hace mas de 15 dias y no han hecho nada para quitar las retenciones salariales, no se metan con icetex no lo hagan son muy ladrones|negative

Desde inicios de este año estoy tratando de vincular mi cuenta bancaria para recibir el giro de sostenimiento que tengo pendiente del 2020, me he comunicado todos los dias desde esta fecha y envio correos donde me responden que ya esta vinculada la cuenta y me hacen esperar 15 dias habiles y al momento de consultar me aparece inscrita otra cuenta, no se en realidad que carajos pasa pero ya llevo muchisimo tiempo y no tengo una respuesta, he echo todo al pie de de la letra y no me hacen efectiva la vinculación, los asesores en la linea telefonica son lo mismo, parece que les pagaran por el optimismo pq siempre que dicen que todo esta perfecto que ya va a llegar el giro, cuando ni la vinculacion la hacen, entonces espero su respuesta pronta, gracias|negative
ICETEX que puntaje necesito para acceder a un crédito con fondo de garantías si no cuento con deudor solidario ??????|negative
no se vayan a meter con icetex son unas completas ratas de alcantarillas se hizo un acuerdo de pago hace mas de 15 dias y no han hecho nada para quitar las retenciones salariales, no se metan con icetex no lo hagan son muy ladrones|negative
no se vayan a meter con icetex son unas completas ratas de alcantarillas se hizo un acuerdo de pago hace mas de 15 dias y no han hecho nada para quitar las retenciones salariales, no se metan con icetex no lo hagan son muy ladrones|negative
Nunca pidan crédito con esta Institución, tienen muy mala atención, los asesores se burlan de ti, te niegan la radicación de quejas, te obligan a llenar requisitos interminables, y en general hacen todo lo posible por no atenderte. La plataforma de el ICETEX es perversa, no está actualizada y tiene problemas en cada uno de los formularios; el ICETEX no envían las facturas a tiempo y las que están en la plataforma de estado de cuenta no están al día, entonces nunca sabes cuánto realmente estás debiendo. Es mejor pedir un crédito con un banco que con este desastre de institución.|negative
no se vayan a meter con icetex son unas completas ratas de alcantarillas se hizo un acuerdo de pago hace mas de 15 dias y no han hecho nada para quitar las retenciones salariales, no se metan con icetex no lo hagan son muy ladrones|negative
Luz María Aponte Alcántara Juanda Caicedo|neutral
Cuando inicia la convocatoria |neutral
Esperando devolución de garantías por pago total d deuda  hace año y medio  y la respuesta es la misma pegan y pegan ya le damos respuesta de fondo y la respuesta es la misma d hace año y medio q desorganización tan grande|negative
Y para victimas del conflicto armado cuando empieza la covocatoria|negative
Una inquietud, yo me inscribí en la convocatoria 2021-1 es necesario que me vuelva a inscribir?. Gracias|neutral
Cuando abren las inscripciones del 2021-2 para etnia indigena|neutral
Cuando la de población indígena, para este periodo 2021_2|neutral
No está la opción tarjeta de identidad ni tampoco  la U cooperativa|neutral
Si que acaben con el ICETEX |neutral
deberian aumentarlo hasta diciembre por favor|neutral
Como haga para inscribirme|neutral
Que puntaje se nesesita para entrar y finalizar curso de oficial??|neutral
no se vayan a meter con icetex son unas completas ratas de alcantarillas se hizo un acuerdo de pago hace mas de 15 dias y no han hecho nada para quitar las retenciones salariales, no se metan con icetex no lo hagan son muy ladrones|negative
Ya no se puede aplicar para el credito 2021-1 ya que la universidad de cartagena esta atrasada y apenas dijeron quienes pasaban 2021-1|negative
Y para cuando los giros de sostenimiento?|neutral
Buenas noches, cuanto tiempo se demoran en aprobar un crédito. Gracias|positive
Buenos días, quiero saber como entrar a un crédito educativo sin necesidad de deudor solidario ya que la persona que me iba a servir a pesar de que tienen una buena experiencia crediticia no entra en la edad requerida por uds y no tengo quien me ayude a ser mi deudor solidario :c |positive
Que linda es la publicidad del ICETEX.......|positive
Sobre todo el apoyo que me han brindado, radica uno derechos de petición, radica casos y nadieee responde ni da solución. ¡Nadie está pendiente de mi caso aún cuando tengo una ampliación de crédito aprobada desde el 5 de diciembre del año pasado, como puede ser eso posible!|positive
Llevo  año y medio para devolver unas garantías  lleno formulario y la respuesta es siempre la misma pegan y pegan q ya le va llegar por Dios q desorganización tan grande|negative
Me gustaría que no colocarán como requisito el promedio, pues muchos estudiantes por asan todas sus materias y no logran el promedio. Creo que el requisito debería ser que no se pierda ninguna asignatura.|neutral
En el formulario de solicirud alli toca colacar huella y firma del beneficiario y la pregunta es quien debe firmar y colocar   huella si el beneficiario es menor de edad.|neutral
Nunca pidan crédito con esta Institución, tienen muy mala atención, los asesores se burlan de ti, te niegan la radicación de quejas, te obligan a llenar requisitos interminables, y en general hacen todo lo posible por no atenderte. La plataforma de el ICETEX es perversa, no está actualizada y tiene problemas en cada uno de los formularios; el ICETEX no envían las facturas a tiempo y las que están en la plataforma de estado de cuenta no están al día, entonces nunca sabes cuánto realmente estás debiendo. Es mejor pedir un crédito con un banco que con este desastre de institución.|negative
